{
  "schemaVersion": "v1",
  "runId": "readinesscanary_asset_jup",
  "subjectKind": "asset",
  "subjectKey": "JUP",
  "venueKey": "jupiter",
  "assetKey": "JUP",
  "pairSymbol": "JUP/USDC",
  "adapterKey": "jupiter",
  "triggerSource": "manual",
  "status": "success",
  "inputMint": "EPjFWdd5AufqSSqeM2qN1xzybapC8G4wEGGkZwyTDt1v",
  "outputMint": "JUPyiwrYJFskUPiHa7hkeR8VUtAeFoSYbKedZNsDvCN",
  "targetNotionalUsd": "5",
  "walletId": "wallet_strategy_lab",
  "walletAddress": "11111111111111111111111111111111",
  "receiptId": "receipt_asset_jup",
  "signature": "stub_readinesscanaryassetjup",
  "reconciliation": {
    "status": "passed",
    "actualOutputAtomic": "1000",
    "minExpectedOutAtomic": "900",
    "notes": ["stub mode"]
  },
  "evidenceRefs": [
    {
      "kind": "live_canary",
      "ref": "signature:stub_readinesscanaryassetjup"
    }
  ],
  "metadata": {
    "requestedBy": "codex",
    "pairSymbol": "JUP/USDC"
  },
  "startedAt": "2026-03-11T12:00:00.000Z",
  "completedAt": "2026-03-11T12:01:00.000Z"
}
